.autotune_cache.json
{
  "meta": {
    "gpu": "NVIDIA GeForce RTX 3090",
    "triton_version": "3.2.0",
    "created": "2026-04-08T22:54:10"
  },
  "flash_scoring_kernel": {
    "(512, 512, 4, 64, 64, 1)__H4__D64": {
      "Q_BS": 16,
      "KV_BS": 128,
      "num_warps": 4,
      "bench_ms": 0.019,
      "H": 4,
      "D": 64
    },
    "(512, 512, 4, 64, 64, 1)__H4__D128": {
      "Q_BS": 16,
      "KV_BS": 64,
      "num_warps": 4,
      "bench_ms": 0.027,
      "H": 4,
      "D": 128
    },
    "(512, 512, 4, 64, 64, 1)__H16__D64": {
      "Q_BS": 32,
      "KV_BS": 64,
      "num_warps": 4,
      "bench_ms": 0.037,
      "H": 16,
      "D": 64
    },
    "(512, 512, 4, 64, 64, 1)__H16__D128": {
      "Q_BS": 32,
      "KV_BS": 64,
      "num_warps": 4,
      "bench_ms": 0.066,
      "H": 16,
      "D": 128
    },
    "(1024, 1024, 4, 64, 64, 1)__H4__D64": {
      "Q_BS": 16,
      "KV_BS": 64,
      "num_warps": 4,
      "bench_ms": 0.044,
      "H": 4,
      "D": 64
    },
    "(1024, 1024, 4, 64, 64, 1)__H4__D128": {
      "Q_BS": 32,
      "KV_BS": 64,
      "num_warps": 4,
      "bench_ms": 0.065,
      "H": 4,
      "D": 128
    },
    "(1024, 1024, 4, 64, 64, 1)__H16__D64": {
      "Q_BS": 32,
      "KV_BS": 64,
      "num_warps": 4,
      "bench_ms": 0.112,
      "H": 16,
      "D": 64
    },
    "(1024, 1024, 4, 64, 64, 1)__H16__D128": {
      "Q_BS": 32,
      "KV_BS": 64,
      "num_warps": 4,
      "bench_ms": 0.216,
      "H": 16,
      "D": 128
    },
    "(1024, 1024, 4, 128, 128, 1)__H4__D64": {
      "Q_BS": 32,
      "KV_BS": 64,
      "num_warps": 4,
      "bench_ms": 0.04,
      "H": 4,
      "D": 64
    },
    "(1024, 1024, 4, 128, 128, 1)__H4__D128": {
      "Q_BS": 32,
      "KV_BS": 64,
      "num_warps": 4,
      "bench_ms": 0.06,
      "H": 4,
      "D": 128
    },
    "(1024, 1024, 4, 128, 128, 1)__H16__D64": {
      "Q_BS": 32,
      "KV_BS": 64,
      "num_warps": 4,
      "bench_ms": 0.102,
      "H": 16,
      "D": 64
    },
    "(1024, 1024, 4, 128, 128, 1)__H16__D128": {
      "Q_BS": 32,
      "KV_BS": 64,
      "num_warps": 4,
      "bench_ms": 0.198,
      "H": 16,
      "D": 128
    },
    "(4096, 4096, 4, 64, 64, 1)__H4__D64": {
      "Q_BS": 32,
      "KV_BS": 64,
      "num_warps": 4,
      "bench_ms": 0.432,
      "H": 4,
      "D": 64
    },
    "(4096, 4096, 4, 64, 64, 1)__H4__D128": {
      "Q_BS": 32,
      "KV_BS": 64,
      "num_warps": 4,
      "bench_ms": 0.821,
      "H": 4,
      "D": 128
    },
    "(4096, 4096, 4, 64, 64, 1)__H16__D64": {
      "Q_BS": 32,
      "KV_BS": 64,
      "num_warps": 4,
      "bench_ms": 1.56,
      "H": 16,
      "D": 64
    },
    "(4096, 4096, 4, 64, 64, 1)__H16__D128": {
      "Q_BS": 32,
      "KV_BS": 64,
      "num_warps": 4,
      "bench_ms": 2.883,
      "H": 16,
      "D": 128
    },
    "(4096, 4096, 8, 128, 128, 1)__H4__D64": {
      "Q_BS": 32,
      "KV_BS": 128,
      "num_warps": 4,
      "bench_ms": 0.484,
      "H": 4,
      "D": 64
    },
    "(4096, 4096, 8, 128, 128, 1)__H4__D128": {
      "Q_BS": 32,
      "KV_BS": 64,
      "num_warps": 4,
      "bench_ms": 0.752,
      "H": 4,
      "D": 128
    },
    "(4096, 4096, 8, 128, 128, 1)__H16__D64": {
      "Q_BS": 32,
      "KV_BS": 128,
      "num_warps": 4,
      "bench_ms": 1.725,
      "H": 16,
      "D": 64
    },
    "(4096, 4096, 8, 128, 128, 1)__H16__D128": {
      "Q_BS": 32,
      "KV_BS": 64,
      "num_warps": 4,
      "bench_ms": 2.699,
      "H": 16,
      "D": 128
    },
    "(16384, 16384, 4, 64, 64, 1)__H4__D64": {
      "Q_BS": 32,
      "KV_BS": 64,
      "num_warps": 4,
      "bench_ms": 6.269,
      "H": 4,
      "D": 64
    },
    "(16384, 16384, 4, 64, 64, 1)__H4__D128": {
      "Q_BS": 32,
      "KV_BS": 64,
      "num_warps": 4,
      "bench_ms": 11.55,
      "H": 4,
      "D": 128
    },
    "(16384, 16384, 4, 64, 64, 1)__H16__D64": {
      "Q_BS": 32,
      "KV_BS": 64,
      "num_warps": 4,
      "bench_ms": 25.118,
      "H": 16,
      "D": 64
    },
    "(16384, 16384, 4, 64, 64, 1)__H16__D128": {
      "Q_BS": 32,
      "KV_BS": 64,
      "num_warps": 4,
      "bench_ms": 46.755,
      "H": 16,
      "D": 128
    },
    "(16384, 16384, 4, 128, 128, 1)__H4__D64": {
      "Q_BS": 32,
      "KV_BS": 64,
      "num_warps": 4,
      "bench_ms": 5.846,
      "H": 4,
      "D": 64
    },
    "(16384, 16384, 4, 128, 128, 1)__H4__D128": {
      "Q_BS": 32,
      "KV_BS": 64,
      "num_warps": 4,
      "bench_ms": 10.947,
      "H": 4,
      "D": 128
    },
    "(16384, 16384, 4, 128, 128, 1)__H16__D64": {
      "Q_BS": 32,
      "KV_BS": 64,
      "num_warps": 4,
      "bench_ms": 23.11,
      "H": 16,
      "D": 64
    },
    "(16384, 16384, 4, 128, 128, 1)__H16__D128": {
      "Q_BS": 32,
      "KV_BS": 64,
      "num_warps": 4,
      "bench_ms": 44.496,
      "H": 16,
      "D": 128
    },
    "(16896, 16896, 4, 64, 64, 1)__H4__D64": {
      "Q_BS": 32,
      "KV_BS": 64,
      "num_warps": 4,
      "bench_ms": 7.393,
      "H": 4,
      "D": 64
    },
    "(16896, 16896, 4, 64, 64, 1)__H4__D128": {
      "Q_BS": 32,
      "KV_BS": 64,
      "num_warps": 4,
      "bench_ms": 13.25,
      "H": 4,
      "D": 128
    },
    "(16896, 16896, 4, 64, 64, 1)__H16__D64": {
      "Q_BS": 32,
      "KV_BS": 64,
      "num_warps": 4,
      "bench_ms": 29.494,
      "H": 16,
      "D": 64
    },
    "(16896, 16896, 4, 64, 64, 1)__H16__D128": {
      "Q_BS": 32,
      "KV_BS": 64,
      "num_warps": 4,
      "bench_ms": 52.809,
      "H": 16,
      "D": 128
    },
    "(16896, 16896, 4, 128, 128, 1)__H4__D64": {
      "Q_BS": 32,
      "KV_BS": 64,
      "num_warps": 4,
      "bench_ms": 6.612,
      "H": 4,
      "D": 64
    },
    "(16896, 16896, 4, 128, 128, 1)__H4__D128": {
      "Q_BS": 32,
      "KV_BS": 64,
      "num_warps": 4,
      "bench_ms": 12.634,
      "H": 4,
      "D": 128
    },
    "(16896, 16896, 4, 128, 128, 1)__H16__D64": {
      "Q_BS": 32,
      "KV_BS": 64,
      "num_warps": 4,
      "bench_ms": 27.252,
      "H": 16,
      "D": 64
    },
    "(16896, 16896, 4, 128, 128, 1)__H16__D128": {
      "Q_BS": 32,
      "KV_BS": 64,
      "num_warps": 4,
      "bench_ms": 48.104,
      "H": 16,
      "D": 128
    },
    "(32768, 32940, 2, 256, 180, 0)__H4__D64": {
      "Q_BS": 32,
      "KV_BS": 64,
      "num_warps": 4,
      "bench_ms": 25.8,
      "H": 4,
      "D": 64
    },
    "(32768, 32940, 2, 256, 180, 0)__H4__D128": {
      "Q_BS": 32,
      "KV_BS": 64,
      "num_warps": 4,
      "bench_ms": 50.028,
      "H": 4,
      "D": 128
    },
    "(32768, 32940, 2, 256, 180, 0)__H16__D64": {
      "Q_BS": 32,
      "KV_BS": 64,
      "num_warps": 4,
      "bench_ms": 105.042,
      "H": 16,
      "D": 64
    },
    "(32768, 32940, 2, 256, 180, 0)__H16__D128": {
      "Q_BS": 32,
      "KV_BS": 64,
      "num_warps": 4,
      "bench_ms": 209.774,
      "H": 16,
      "D": 128
    },
    "(32768, 32940, 4, 256, 180, 0)__H4__D64": {
      "Q_BS": 32,
      "KV_BS": 64,
      "num_warps": 4,
      "bench_ms": 34.034,
      "H": 4,
      "D": 64
    },
    "(32768, 32940, 4, 256, 180, 0)__H4__D128": {
      "Q_BS": 32,
      "KV_BS": 64,
      "num_warps": 4,
      "bench_ms": 53.103,
      "H": 4,
      "D": 128
    },
    "(32768, 32940, 4, 256, 180, 0)__H16__D64": {
      "Q_BS": 32,
      "KV_BS": 64,
      "num_warps": 4,
      "bench_ms": 139.101,
      "H": 16,
      "D": 64
    },
    "(32768, 32940, 4, 256, 180, 0)__H16__D128": {
      "Q_BS": 32,
      "KV_BS": 64,
      "num_warps": 4,
      "bench_ms": 224.69,
      "H": 16,
      "D": 128
    },
    "(65536, 65700, 2, 256, 180, 0)__H4__D64": {
      "Q_BS": 32,
      "KV_BS": 64,
      "num_warps": 4,
      "bench_ms": 109.616,
      "H": 4,
      "D": 64
    },
    "(65536, 65700, 2, 256, 180, 0)__H4__D128": {
      "Q_BS": 32,
      "KV_BS": 64,
      "num_warps": 4,
      "bench_ms": 211.01,
      "H": 4,
      "D": 128
    },
    "(65536, 65700, 2, 256, 180, 0)__H16__D64": {
      "Q_BS": 32,
      "KV_BS": 64,
      "num_warps": 4,
      "bench_ms": 436.945,
      "H": 16,
      "D": 64
    },
    "(65536, 65700, 2, 256, 180, 0)__H16__D128": {
      "Q_BS": 32,
      "KV_BS": 64,
      "num_warps": 4,
      "bench_ms": 867.405,
      "H": 16,
      "D": 128
    },
    "(70385, 70560, 2, 256, 180, 0)__H4__D64": {
      "Q_BS": 32,
      "KV_BS": 64,
      "num_warps": 4,
      "bench_ms": 120.078,
      "H": 4,
      "D": 64
    },
    "(70385, 70560, 2, 256, 180, 0)__H4__D128": {
      "Q_BS": 32,
      "KV_BS": 64,
      "num_warps": 4,
      "bench_ms": 250.494,
      "H": 4,
      "D": 128
    },
    "(70385, 70560, 2, 256, 180, 0)__H16__D64": {
      "Q_BS": 32,
      "KV_BS": 64,
      "num_warps": 4,
      "bench_ms": 493.215,
      "H": 16,
      "D": 64
    },
    "(70385, 70560, 2, 256, 180, 0)__H16__D128": {
      "Q_BS": 32,
      "KV_BS": 64,
      "num_warps": 4,
      "bench_ms": 1036.623,
      "H": 16,
      "D": 128
    },
    "(70385, 70560, 4, 256, 180, 0)__H4__D64": {
      "Q_BS": 32,
      "KV_BS": 64,
      "num_warps": 4,
      "bench_ms": 133.205,
      "H": 4,
      "D": 64
    },
    "(70385, 70560, 4, 256, 180, 0)__H4__D128": {
      "Q_BS": 32,
      "KV_BS": 64,
      "num_warps": 4,
      "bench_ms": 269.426,
      "H": 4,
      "D": 128
    },
    "(70385, 70560, 4, 256, 180, 0)__H16__D64": {
      "Q_BS": 32,
      "KV_BS": 64,
      "num_warps": 4,
      "bench_ms": 539.112,
      "H": 16,
      "D": 64
    },
    "(70385, 70560, 4, 256, 180, 0)__H16__D128": {
      "Q_BS": 32,
      "KV_BS": 64,
      "num_warps": 4,
      "bench_ms": 1116.855,
      "H": 16,
      "D": 128
    },
    "(4096, 4128, 4, 64, 48, 0)__H4__D64": {
      "Q_BS": 32,
      "KV_BS": 32,
      "num_warps": 4,
      "bench_ms": 0.88,
      "H": 4,
      "D": 64
    },
    "(4096, 4128, 4, 64, 48, 0)__H4__D128": {
      "Q_BS": 32,
      "KV_BS": 64,
      "num_warps": 4,
      "bench_ms": 1.473,
      "H": 4,
      "D": 128
    },
    "(4096, 4128, 4, 64, 48, 0)__H16__D64": {
      "Q_BS": 64,
      "KV_BS": 16,
      "num_warps": 8,
      "bench_ms": 3.09,
      "H": 16,
      "D": 64
    },
    "(4096, 4128, 4, 64, 48, 0)__H16__D128": {
      "Q_BS": 32,
      "KV_BS": 64,
      "num_warps": 4,
      "bench_ms": 5.029,
      "H": 16,
      "D": 128
    },
    "(4096, 4128, 4, 128, 96, 0)__H4__D64": {
      "Q_BS": 32,
      "KV_BS": 32,
      "num_warps": 4,
      "bench_ms": 0.641,
      "H": 4,
      "D": 64
    },
    "(4096, 4128, 4, 128, 96, 0)__H4__D128": {
      "Q_BS": 32,
      "KV_BS": 32,
      "num_warps": 4,
      "bench_ms": 0.94,
      "H": 4,
      "D": 128
    },
    "(4096, 4128, 4, 128, 96, 0)__H16__D64": {
      "Q_BS": 32,
      "KV_BS": 32,
      "num_warps": 4,
      "bench_ms": 2.315,
      "H": 16,
      "D": 64
    },
    "(4096, 4128, 4, 128, 96, 0)__H16__D128": {
      "Q_BS": 32,
      "KV_BS": 32,
      "num_warps": 4,
      "bench_ms": 3.295,
      "H": 16,
      "D": 128
    },
    "(16384, 16416, 4, 256, 144, 0)__H4__D64": {
      "Q_BS": 32,
      "KV_BS": 32,
      "num_warps": 4,
      "bench_ms": 9.488,
      "H": 4,
      "D": 64
    },
    "(16384, 16416, 4, 256, 144, 0)__H4__D128": {
      "Q_BS": 32,
      "KV_BS": 32,
      "num_warps": 4,
      "bench_ms": 13.99,
      "H": 4,
      "D": 128
    },
    "(16384, 16416, 4, 256, 144, 0)__H16__D64": {
      "Q_BS": 32,
      "KV_BS": 32,
      "num_warps": 4,
      "bench_ms": 38.537,
      "H": 16,
      "D": 64
    },
    "(16384, 16416, 4, 256, 144, 0)__H16__D128": {
      "Q_BS": 32,
      "KV_BS": 32,
      "num_warps": 4,
      "bench_ms": 54.024,
      "H": 16,
      "D": 128
    },
    "(16384, 16560, 4, 256, 180, 0)__H4__D64": {
      "Q_BS": 32,
      "KV_BS": 64,
      "num_warps": 4,
      "bench_ms": 6.707,
      "H": 4,
      "D": 64
    },
    "(16384, 16560, 4, 256, 180, 0)__H4__D128": {
      "Q_BS": 32,
      "KV_BS": 64,
      "num_warps": 4,
      "bench_ms": 13.563,
      "H": 4,
      "D": 128
    },
    "(16384, 16560, 4, 256, 180, 0)__H16__D64": {
      "Q_BS": 32,
      "KV_BS": 64,
      "num_warps": 4,
      "bench_ms": 27.222,
      "H": 16,
      "D": 64
    },
    "(16384, 16560, 4, 256, 180, 0)__H16__D128": {
      "Q_BS": 32,
      "KV_BS": 64,
      "num_warps": 4,
      "bench_ms": 55.652,
      "H": 16,
      "D": 128
    },
    "(70385, 70416, 4, 256, 144, 0)__H4__D64": {
      "Q_BS": 32,
      "KV_BS": 32,
      "num_warps": 4,
      "bench_ms": 185.983,
      "H": 4,
      "D": 64
    },
    "(70385, 70416, 4, 256, 144, 0)__H4__D128": {
      "Q_BS": 32,
      "KV_BS": 32,
      "num_warps": 4,
      "bench_ms": 309.231,
      "H": 4,
      "D": 128
    },
    "(70385, 70416, 4, 256, 144, 0)__H16__D64": {
      "Q_BS": 32,
      "KV_BS": 32,
      "num_warps": 4,
      "bench_ms": 744.77,
      "H": 16,
      "D": 64
    },
    "(70385, 70416, 4, 256, 144, 0)__H16__D128": {
      "Q_BS": 32,
      "KV_BS": 32,
      "num_warps": 4,
      "bench_ms": 1241.443,
      "H": 16,
      "D": 128
    },
    "(70385, 70500, 4, 512, 300, 0)__H4__D64": {
      "Q_BS": 32,
      "KV_BS": 128,
      "num_warps": 4,
      "bench_ms": 158.731,
      "H": 4,
      "D": 64
    },
    "(70385, 70500, 4, 512, 300, 0)__H4__D128": {
      "Q_BS": 32,
      "KV_BS": 64,
      "num_warps": 4,
      "bench_ms": 258.119,
      "H": 4,
      "D": 128
    },
    "(70385, 70500, 4, 512, 300, 0)__H16__D64": {
      "Q_BS": 32,
      "KV_BS": 128,
      "num_warps": 4,
      "bench_ms": 624.906,
      "H": 16,
      "D": 64
    },
    "(70385, 70500, 4, 512, 300, 0)__H16__D128": {
      "Q_BS": 32,
      "KV_BS": 64,
      "num_warps": 4,
      "bench_ms": 1058.181,
      "H": 16,
      "D": 128
    }
  }
}